实体名称,中文名,中文名称,外文名,英文名称,简称,别名,国家代码,政治体制,国家领袖,首都,国土面积,所属洲,时区,货币,主要民族,主要宗教,主要城市,官方语言,国歌,国庆日,最大城市,国家象征,法律体系,行政区划代码,行政区类别,所属地区,地理位置,下辖地区,政府驻地,著名景点,著名学府,省长,省委书记,州长,参议员,市长,市委书记,县长,主要组织,包含国家
大连,大连,,Dalian/далянь/대련,,,"浪漫之都,足球城",,,,,,,,,,,,,,,,,,210200,地级市,中国东北地区,辽东半岛最南端,7个区、1个县、代管2个县级市,西岗区,星海广场、棒棰岛、老虎滩海洋公园、金石滩国家度假区等,,,,,,,,,,
湄公河,湄公河,,Mekong River,,,东方多瑙河,,,,,,,,,,,,,,,,,,,,,东亚、东南亚、中南半岛,,,西藏高原,,,,,,,,,,
北戴河,,北戴河区,,,,,,,,,,,,,,,,,,,,,,,市辖区,河北省秦皇岛市,秦皇岛市西南部,海滨镇、戴河镇、西山街道、东山街道、牛头崖镇,联峰北路88号[4] ,鸽子窝公园、怪楼奇园、联峰山、南戴河、老虎石公园、碧螺塔 ,,,,,,,,,,
香港站,香港站,,Hong Kong Station,,,,,,,,,,,,,,,,,,,,,,,,香港中环港景街一号,,,,,,,,,,,,,
苏州市,苏州,,Suzhou/Soochow,,,姑苏/吴中/平江/吴门/东吴[9] ,,,,,,,,,,,,,,,,,,,地级市,中国华东地区,江苏省东南部、太湖东岸,5个市辖区、代管4个县级市,姑苏区三香路998号,拙政园、狮子林、沧浪亭、留园、周庄、虎丘、寒山寺、金鸡湖等,,,,,,,,,,
相城区,,相城区,,,,吴县,,,,,,,,,,,,,,,,,,,市辖区,中国华东,江苏省苏州市区北部,4个镇、7个街等[12] ,苏州市相城区阳澄湖东路8号,阳澄湖、荷塘月色湿地公园、盛泽湖月季园等,,,,,,,,,,
长江三角洲,长江三角洲地区,,Yangtze River Delta,,,长三角,,,,,,,,,,,,,,,,,,上海(310000)江苏省(320000)浙江省(330000)安徽省(340000),地理区域,华东地区,中国华东长江中下游平原,3省1市,上海市武康路103号甲,外滩、豫园、夫子庙、西湖、乌镇、横店、黄山、九华山、天柱山等,,,,,,,,,,
合肥市,合肥,,Hefei、Ho-fei,,,庐州、庐阳、合州、绿城、中国声谷、IC之都,,,,,,,,,,,,,,,,,,340100,地级市,中国华东地区,安徽省中部、长江以北、环拥巢湖,"4个市辖区、4个县,代管1个县级市",合肥市蜀山区东流路100号,淮河路、黄陂湖、开福寺、包公园、三河古镇、巢湖、紫蓬山、李府,,,,,,,,,,
温布利体育场,温布利球场,,Wembley Stadium,,,,,,,,,,,,,,,,,,,,,,,,,,,,,,,,,,,,,
索非亚,索非亚,,София,,,,,,,,,,,,,,,,,,,,,,首都,保加利亚,"保加利亚中西部,索菲亚盆地内[1] ",,,"圣索非亚教堂,季米特洛夫陵墓等[1] ",,,,,,,,,,
西城,西城区,,Xi Cheng District,,,,,,,,,,,,,,,,,,,,,110102,市辖区,北京市,北京中心城区西部,15个街道,金融街街道二龙路27号[7] ,中南海、人民大会堂、景山公园、陶然亭,,,,,,,,,,
肯辛顿区,肯辛顿-切尔西区,,Royal Borough of Kensington and Chelsea,,,,,,,,,,,,,,,,,,,,,,,,,,,,,,,,,,,,,
伦敦金融城,,伦敦金融城,,,,,,,,,,,,,,,,,,,,,,,,,圣保罗大教堂东侧,,,,,,,,,,,,,
卡罗莱纳州,,卡罗莱纳州,,,,,,,,拉雷 ,,,,,,,,,,,,,,,,,,,,,,,,,,,,,,
哈德逊河,,哈德逊河,,,,哈德孙河、哈德森河,,,,,,,,,,,,,,,,,,,,美国纽约州,北美洲东北部阿巴拉契亚山脉西侧,,,,,,,,,,,,,
金门大桥,金门大桥,,Golden Gate Bridge,,,,,,,,,,,,,,,,,,,,,,,,,,,,,,,,,,,,,
巴巴多斯,,巴巴多斯[3] ,,Barbados[3] ,,,BRB,议会制君主立宪制,总督:桑德拉·普鲁内拉·梅森;总理:弗罗因德尔·斯图亚特,布里奇顿[3] ,431平方公里[3] ,北美洲,UTC-4,巴巴多斯元[3] ,"非洲黑人后裔,欧洲人后裔",基督教,斯佩茨顿、霍尔顿等,英语[3] ,In Plenty and In Time of Need,11月30日,,,,,,,,,,,,,,,,,,,,
开普敦,开普敦,,Cape Town,,,Kaapstad,,,,,,,,,,,,,,,,,,,市,南非共和国西开普省,南非共和国西开普省,,,好望角、桌山,,,,,,,,,,
埃菲尔铁塔,埃菲尔铁塔,,Eiffel Tower(英文)  La Tour Eiffel(法文),,,巴黎铁塔,,,,,,,,,,,,,,,,,,,,,法国巴黎战神广场,,,战神广场、埃菲尔铁塔,,,,,,,,,,
苏萨,苏萨,,Susa,,,,,,,,,,,,,,,,,,,,,,,,,,,,,,,,,,,,,
伦敦希思罗机场,希思罗机场,,Heathrow Airport,,,,,,,,,,,,,,,,,,,,,,,英国英格兰大伦敦希灵登区,,,,,,,,,,,,,,
北林肯郡,,北林肯郡,,,,,,,,,,,,,,,,,,,,,,,约克郡-亨伯,,,,,,,,,,,,,,,
普雷斯顿,普雷斯顿市,,Preston,,,,,,,,,,,,,,,,,,,,,,,,,,,,,,,,,,,,,
新南威尔士,,新南威尔士州,,,,新州、纽修威省、纽省,,,,,,,,,,,,,,,,,,,一级行政区,澳大利亚联邦,位于澳大利亚东南部,悉尼市等,悉尼市,悉尼歌剧院、海港大桥等,,,,,,,,,,
谢菲尔德,,谢菲尔德,,,,“谢村”,,,,,,,,,,,,,,,,,,,都市自治市,英国南约克郡,英格兰中部,,谢菲尔德市中心,"兰心戏院,坩埚剧院,谢菲尔德冬季花园,和平花园,植物园",,,,,,,,,,
克什米尔,克什米尔,,英文:Jammu and Kashmir;印地语:कश्मीर;乌尔都语:کشمیر,,,查谟和克什米尔,,,,,,,,印度卢比、巴基斯坦卢比,,,,,,,,,,,,,南亚西北部,,,喜马拉雅山脉、乔戈里峰、帕尔巴特峰、查谟丘陵、卢姆河,,,,,,,,,,
钓鱼岛,,钓鱼岛,,,,钓鱼台、钓鱼屿、钓鱼山,,,,,,,,,,,,,,,,,,,岛屿,中国东海地区,,"赤尾屿,黄尾屿,南小岛,北小岛",无人岛屿,钓鱼岛及附属岛屿,,,,,,,,,,
尖阁列岛,,钓鱼岛,,,,钓鱼台、钓鱼屿、钓鱼山,,,,,,,,,,,,,,,,,,,岛屿,中国东海地区,,"赤尾屿,黄尾屿,南小岛,北小岛",无人岛屿,钓鱼岛及附属岛屿,,,,,,,,,,
胡志明市,胡志明市,,Ho Chi Minh City(英)Thành phố Hồ Chí Minh(越南语),,,西贡Sài Gòn(越南语),,,,,,,,,,,,,,,,,,,直辖市,越南,湄公河三角洲地区,19个郡区和5个县,"86 Lê Thánh Tôn,Phường Bến Nghé,Quận 1",仙泉旅游公园、红教堂、总统府,,,,,,,,,,
文莱,,文莱达鲁萨兰国,,Negara Brunei Darussalam,文莱,,BRN,君主专制政体,苏丹:哈吉·哈桑纳尔·博尔基亚,斯里巴加湾市,5765平方公里(世界第172名),亚洲,UTC+8,文莱元,马来人、华人,伊斯兰教、佛教、基督教、道教,马来奕、文莱摩拉,马来语,《真主保佑文莱》,1984年(甲子年)2月23日,斯里巴加湾市,,,,,,,,,,,,,,,,,,,
中南海,中南海,,Zhong Nan Hai,,,,,,,,,,,,,,,,,,,,,,,,,,,,,,,,,,,,,
合肥,合肥,,Hefei、Ho-fei,,,庐州、庐阳、合州、绿城、中国声谷、IC之都,,,,,,,,,,,,,,,,,,340100,地级市,中国华东地区,安徽省中部、长江以北、环拥巢湖,"4个市辖区、4个县,代管1个县级市",合肥市蜀山区东流路100号,淮河路、黄陂湖、开福寺、包公园、三河古镇、巢湖、紫蓬山、李府,,,,,,,,,,
加泰罗尼亚,加泰罗尼亚,,Catalana(加泰罗尼亚语)、Catalan(英语),,,Catalunya(原西班牙属加泰罗尼亚语邦名),,,,,,,,,,,,,,,,,,,国家(未被承认)、自治区(自治权被剥夺),西班牙东北,伊比利亚半岛东北部,巴塞罗那省、莱里达省、赫罗纳省和塔拉戈纳省等4省,巴塞罗那,"毕加索博物馆,圣家族大教堂等",,,,,,,,,,
拉斯维加斯,,拉斯维加斯,,,,"世界娱乐之都,赌城,拉斯维加斯、",,,,,,,,,,,,,,,,,,,市,美国内华达州,"36°10’N,115°08’W",克拉克县,,"拉斯维加斯天空酒店,拉斯维加斯会议展览中心",,,,,,卡罗琳·古德曼,,,,
伊斯法罕,伊斯法罕,,"Esfahan,اصفهان",,,,,,,,,,,,,,,,,,,,,,省会,伊朗,扎格罗斯山和库赫鲁山的谷地中、扎因代河畔,,,"国王清真寺,阿里卡普宫,四十柱宫,伊玛目广场",,,,,,,,,,
西柏林,,西柏林,,,,大柏林市,,,,,,,,,,,,,,,,,,,市,西德,东德国境内,,西柏林,,,,,,,,,,,
山西,山西,,Shanxi,,,晋、三晋,,,,,,,,,,,,,,,,,,140000,省,中国华北地区,华北,11个地级市,太原市小店区长风街30号[8] ,五台山、平遥古城、云冈石窟、乔家大院、皇城相府等,,,,,,,,,,
天府广场,天府广场,,Tianfu Square ,,,,,,,,,,,,,,,,,,,,,,,四川省成都市锦江区,,,,,,,,,,,,,,
澳门特区,澳门,,Macau(葡)、Macao(英),,,妈港、濠江、梳打埠、马交、濠海、濠镜、濠镜澳、香山澳等,,行政主导的代议民主制,,,,,,人民币、澳门币、港币,,,,中文(含粤语、普通话)、葡语[9] ,,,,,大陆法系,820000,特别行政区,中华人民共和国 华南地区,珠江三角洲西南部、珠江口西岸,7个堂区,澳门半岛风顺堂区南湾湖景大马路131号,澳门历史城区、大三巴牌坊、观光塔、葡京赌场、妈阁庙、谭公庙等,,,,,,,,,,
郝柏村,郝柏村,,,,,伯春,,,,,,,,,,,,,,,,,,,,,,,,,,,,,,,,,,
重庆,重庆,,"Chongqing,Chungking",,,山城、巴渝、渝州、雾都、桥都、江城,,,,,,,,,,,,,,,,,,500000,直辖市,中国西南地区,长江上游地区 中国内陆西南部,26个区、8个县、4个自治县,渝中区人民路232号,洪崖洞、大足石刻、武隆喀斯特旅游区、长江三峡、武陵山大裂谷等,,,,,,唐良智,陈敏尔[16] ,,,
郝伯村,郝柏村,,,,,伯春,,,,,,,,,,,,,,,,,,,,,,,,,,,,,,,,,,
莫斯科红场,,红场,,,,,,,,,,,,,,,,,,,,,,,,,,,,,,,,,,,,,,
别斯兰,,别斯兰,,,,Beslanykau,,,,,,,,,,,,,,,,,,,镇,俄罗斯北奥塞梯共和国,顿河畔罗斯托夫到巴库铁路之间,,,,,,,,,,,,,
北马里亚纳群岛,北马里亚纳群岛,,Northern Mariana Islands,,,,,,,,,,,,,,,,,,,,,,,,,,,,,,,,,,,,,
马尼拉,马尼拉,,Manila,,,岷里拉,,,,,,,,,,,,,,,,,,,首都,菲律宾国家首都大区,"北纬15°,东经121°",马卡蒂、阿拉邦、曼达路永、马利金纳、文珍俞巴、纳沃达斯、帕赛市、帕西格,马尼拉,黎刹尔公园、罗哈斯海滨大道、玛拉干南官、奥古斯丁教堂等,,,,,,约瑟夫·埃杰西多·埃斯特拉达,,,,
硫磺岛,,硫磺岛,,,,,,,,,,,,,,,,,,,,,,,日本东京都,太平洋菲律宾海,,,,,,,,,,,,,,
和平纪念公园,和平纪念公园,,,,,,,,,,,,,,,,,,,,,,,,,,,,,,,,,,,,,,,
中华人民共和国香港特别行政区,香港,,Hong Kong,,,香江、香岛、东方之珠,,行政主导的代议民主制,,,,,GMT+8,港元(HK$),,,,,,,,,英美法系,,特别行政区,中国华南,"珠江三角洲东南部,珠江口东岸,南海北部","香港岛、九龙半岛、新界,共18区",香港岛中西区添马添美道2号,维多利亚港、香港迪士尼乐园、海洋公园、香港杜莎夫人蜡像馆等,,,,,,,,,,
阿克赛钦,,阿克赛钦,,,,中国的白石滩,,,,,,,,,,,,,,,,,,,,大部属新疆和田地区、南侧属西藏阿里地区,中国新疆西藏与印度霸占的拉达克的东方,,,阿克赛钦湖、新藏公路,,,,,,,,,,
阿萨姆,,阿萨姆邦,,,,,,,,,,,,,,,,,,,,,,,邦,印度,"亚洲南部,中国西南部",27个县,第斯布尔,丘陵茶园、雅鲁藏布江、寺庙,,,,,,,,,,
麦克马洪线,麦克马洪线,,McMahon Line,,,,,,,,,,,,,,,,,,,,,,,,,,,,,,,,,,,,,
印度次大陆,南亚次大陆,,The South Asian Subcontinent,,,,,,,,,,,,,,,,,,,,,,,,,,,,,,,,,,,,,
喀拉喀什,,墨玉县,,,,喀拉喀什,,,,,,,,,,,,,,,,,,,县,新疆维吾尔自治区·和田地区,"昆仑山北麓,塔里木盆地西南部",辖1个镇、15个乡,喀拉喀什镇,封建庄园;奎牙小刀;艾德莱丝绸;古代城堡,,,,,,,,,,
锡金邦,,锡金,,,,哲孟雄,,,,,,,UTC+5:30,印度卢比,尼泊尔族、锡金族、雷布查族等,红教、印度教,,,,,,,,,邦,印度,,,甘托克,干城章嘉峰[1] ,,,,,,,,,,
什约克河,什约克河,,Shyok River,,,,,,,,,,,,,,,,,,,,,,,,,,,,,,,,,,,,,
喀喇昆仑公路,喀喇昆仑公路,,Karakoram Highway,,,中巴友谊公路或帕米尔公路,,,,,,,,,,,,,,,,,,,,,,,,,,,,,,,,,,
阿拉伯海,阿拉伯海,,Arabian Sea,,,,,,,,,,,,,,,,,,,,,,,,,,,,,,,,,,,,,
西藏军区,中国人民解放军西藏军区,,,,西藏军区,,,,,,,,,,,,,,,,,,,,,,,,,,,,,,,,,,,
念青唐古拉山,念青唐古拉山脉,,Nyenchenthanglha,,,,,,,,,,,,,,,,,,,,,,,西南地区,西藏中东部,,,,,,,,,,,,,
拉萨,拉萨市,,Lhasa,,,逻些、日光城[2] ,,,,,,,,,,,,,,,,,,540100,地级市,西藏自治区,"中国西南边陲,青藏高原中南部",3个区、5个县,城关区,"布达拉宫,罗布林卡,大昭寺,小昭寺,哲蚌寺,色拉寺等",,,,,,,,,,
坦桑尼亚,,坦桑尼亚联合共和国[1] ,,The United Republic of Tanzania[2] ,坦桑尼亚,,TZA,总统制共和制,总统:约翰·蓬贝·约瑟夫·马古富力[1] ,多多马[1] ,945087平方公里,非洲,UTC+3,坦桑尼亚先令[1] ,苏库马人、尼亚姆维奇人、阿拉伯人,伊斯兰教、天主教、基督新教,达累斯萨拉姆、阿鲁沙、姆万扎、桑给巴尔,英语、斯瓦希里语[1] ,《上帝保佑非洲》,1964年4月26日,,,,,,,,,,,,,,,,,,,,
比哈尔邦,比哈尔邦,,Bihar,,,,,,,,,,,,,,,,,,,,,,邦,印度东北部,,加雅、帕戈尔布尔、达尔班加,巴特那,王舍城、菩提伽耶、那烂陀,,,,,,,,,,
中央邦,中央邦,,Madhya Pradesh,,,,,,,,,,,,,,,,,,,,,,邦,印度中部,印度的中央,博帕尔、贾巴尔普尔、印多尔,博帕尔,克久拉霍遗址群、桑奇佛教遗址、温迪亚山脉比莫贝卡特石窟,,,,,,,,,,
安得拉邦,安得拉邦,,Andhra pradesh,,,,,,,,,,,,,,,,,,,,,,,,,,,,,,,,,,,,,
港珠澳大桥,港珠澳大桥,,Hong Kong-Zhuhai-Macao Bridge,,,,,,,,,,,,,,,,,,,,,,,中国香港、澳门、广东省珠海市,,,,,,,,,,,,,,
深圳湾,深圳湾,,Shenzhen Bay,,,,,,,,,,,,,,,,,,,,,,,,,,,,,,,,,,,,,
宁波,宁波,,Ningbo、Ningpo(旧称),,,甬城、甬上、四明[9] ,,,,,,,,,,,,,,,,,,,地级市,中国浙江省,"浙江省东部,杭州湾南岸",6个区、2个县、代管2个县级市,宁穿路2001号,天一阁、老外滩、宁波博物馆、东钱湖、杭州湾国家湿地公园、月湖,,,,,,,,,,
舟山港,舟山港,,Zhoushan Port,,,,,,,,,,,,,,,,,,,,,,,中国浙江省舟山市,,,,,,,,,,,,,,
长三角,长江三角洲地区,,Yangtze River Delta,,,长三角,,,,,,,,,,,,,,,,,,上海(310000)江苏省(320000)浙江省(330000)安徽省(340000),地理区域,华东地区,中国华东长江中下游平原,3省1市,上海市武康路103号甲,外滩、豫园、夫子庙、西湖、乌镇、横店、黄山、九华山、天柱山等,,,,,,,,,,
法兰西,法兰西共和国[1] ,,French Republic[1] ,,法国、法兰西,,FRA,半总统共和制,总统:埃马纽埃尔·马克龙、总理:让·卡斯泰[3] ,巴黎[1] ,672834平方公里(本土面积543965平方公里)[5] ,欧洲,UTC+1,欧元[1] ,法兰西人、布列塔尼人、科西嘉人、阿尔萨斯人[1] ,天主教[1] ,马赛、里昂、图卢兹、尼斯、南特、斯特拉斯堡、蒙彼利埃、里尔等[1] ,法语[1] ,《马赛曲》[1] ,1789年7月14日[1] ,,,,,,,,,,巴黎圣母院、埃菲尔铁塔、凡尔赛宫、卢浮宫,,,,,,,,,,
爱丁堡,爱丁堡,,The Towns of Edinburgh,,,北方的雅典,,,,,,,,,,,,,,,,,,,首府,英国 苏格兰,苏格兰东海岸入海口,,,皇家英里大道、苏格兰威士忌中心、格雷史东之屋、圣路德公园等,,,,,,,,,,
安特卫普,,安特卫普,,,,,,,,,,,,,,,,,,,,,,,,,比利时西北部斯海尔德河畔,,,,,,,,,,,,,
白宫地堡,白宫地堡,,,,,总统紧急行动中心,,,,,,,,,,,,,,,,,,,,,美国华盛顿特区白宫内,,,,,,,,,,,,,
华盛顿市,,华盛顿哥伦比亚特区,,,,华盛顿、华府、华都,,,,,,,,,,,,,,,,,,,首都、特区,美国,美国东北部,,马丁·路德·金大道(东南)2720号,白宫、国会山、林肯纪念堂、华盛顿纪念碑等,,,,,,穆丽尔·鲍泽,,,,
法拉盛,,法拉盛,,,,,,,,,,,,,,,,,,,,,,,,,,,,,,,,,,,,,,
双城,双城区,,Shuangcheng District,,,双城堡,,,,,,,,,,,,,,,,,,,市辖区,黑龙江省哈尔滨市,哈尔滨市西南部,10个街道、9个镇、8个乡,哈尔滨市双城区新兴大街99号[4] ,双城观音寺、承旭公园、魁星楼、双城状元湖、双城动物园,,,,,,,,,,
朝阳区,朝阳区,,Chao Yang District,,,,,,,,,,,,,,,,,,,,,110105,市辖区,北京市,北京市主城区的东部,24个街道、19个地区,日坛北街33号,亚运村、日坛公园、朝阳公园,,,,,,,,,,
安贞街道,,安贞街道,,,,,,,,,,,,,,,,,,,,,,,街道,北京朝阳,朝阳区西北部,辖6个社区,朝阳区安华西里1区13号楼,西黄寺,,,,,,,,,,
安华里,,,,,,,,,,,,,,,,,,,,,,,,,,,,,,,,,,,,,,,,
布莱顿,布莱顿,,Brighton,,,,,,,,,,,,,,,,,,,,,,,,英格兰南部,,,,,,,,,,,,,
纳土纳群岛,纳土纳群岛,,Natuna Islands,,,,,,,,,,,,,,,,,,,,,,,,南海最南部,,,,,,,,,,,,,
牙山市,,牙山市,,,,,,,,,,,,,,,,,,,,,,,市,韩国,韩国忠清南道北部,10面、7洞,,,,,,,,,,,,
镇川郡,镇川郡,,진천군,,,,,,,,,,,,,,,,,,,,,,,,,,,,,,,,,,,,,
千叶县,,千叶县,,,,房总,,,,,,,,,,,,,,,,,,,一级行政区,日本国,位于日本关东平原东南部,千叶市等,千叶市,"东京迪士尼乐园,东京迪斯尼海洋,成田山新胜寺等",,,,,,,,,,
南加州,,南加州,,,,,,,,,,,,,,,,,,,,,,,,,美国西海岸,,,,,,,,,,,,,
台中市,,台中,,,,中市,,,,,,,,,,,,,,,,,,,"省辖市(1945-2010),“直辖市”(2010-)",中国台湾地区中部,台湾本岛中西部,29区,台中市西屯区台湾大道三段99号,台湾自然科学博物馆、高美湿地、台湾美术馆、逢甲夜市,,,,,,,,,,
努沙登加拉群岛,,小巽他群岛,,,,努沙登加拉群岛,,,,,,,,,,,,,,,,,,,,东南亚,,,,巴厘岛等,,,,,,,,,,
圣诞岛,圣诞岛,,The Territory of Christmas Island,,,圣诞岛领地,,,,,,,UTC+7,,,,,,,,,,,,海外领地,澳大利亚,位于爪哇岛以南,,飞鱼湾,全岛约70%的面积都是国家公园,,,,,,,,,,
约克市,,约克,,,,北方都城,,,,,,,,,,,,,,,,,,,自治市,英国东北部,英格兰北约克郡,,,"约克大教堂,克利福德塔",,,,,,,,,,
牛津郡,,牛津郡,,,,,,,,,,,,,,,,,,,,,,,非都市郡区,英国英格兰南部,位于泰晤士河上游盆地,查韦尔、白马谷、牛津、西牛津郡,牛津,布伦海姆宫(Blenheim Palace),,,,,,,,,,
珍宝岛,,珍宝岛,,,,达曼斯基岛,,,,,,,东八区(UTC+8),,,,,,,,,,,,岛屿,黑龙江省鸡西市虎林市珍宝岛乡,"46°29'1.19""N, 133°50'39.03""E",,,英雄树、乌苏里江,,,,,,,,,,
库姆市,,库姆市,,,,,,,,,,,,,,,,,,,,,,,市,库姆省,"库姆河畔,紧靠卡维尔盐漠",库姆郡,库姆市,法蒂玛陵墓,,,,,,,,,,
曼努菲亚省,,曼努菲亚省(米努夫省),,,,,,,,,,,,,,,,,,,,,,,省,埃及,,,希宾库姆,,,,,,,,,,,
穆巴拉克,穆罕默德·胡斯尼·穆巴拉克,,英文Muhammed Hosni Mubarak;阿拉伯语محمد حسنى سيد مبارك‎,,,,,,,,,,,,,,,,,,,,,,,,,,,,,,,,,,,,,
埃及共和国,阿拉伯埃及共和国[1] ,,The Arab Republic of Egypt[1] ,,埃及,,EGY,总统制共和制,"总统:阿卜杜勒·法塔赫·塞西,总理:穆斯塔法·马德布利",开罗[1] ,1001449 km2[1] ,非洲,UTC+2,埃及镑[1] ,阿拉伯人、科普特人[1] ,伊斯兰教-逊尼派、基督教-科普特教会[1] ,"亚历山大,伊斯梅利亚,塞得港,沙姆沙伊赫,卢克索,阿斯旺等[1] ",阿拉伯语[1] ,《我的祖国》[1] ,1952年7月23日[1] ,,,,,,,,,,,,,,,,,,,,
萨达特,穆罕默德·安瓦尔·萨达特,,"Sadāt,Mohammed Anwaras",,,,,,,,,,,,,,,,,,,,,,,,,,,,,,,,,,,,,
埃塞尔比亚,埃塞俄比亚联邦民主共和国[1] ,,The Federal Democratic Republic of Ethiopia[1] ,,埃塞俄比亚,,ETH,议会制共和制,"总统:萨赫勒-沃克·祖德,总理:阿比·艾哈迈德·阿里",亚的斯亚贝巴[1] ,1103600 km2[1] ,非洲,UTC+3至UTC+4,埃塞俄比亚比尔、辅币分,奥罗莫族、阿姆哈拉族、提格雷族、索马里族、锡达莫族[1] ,埃塞俄比亚正教、伊斯兰教[1] ,德雷达瓦、季马、哈勒尔等,"阿姆哈拉语为联邦工作语言,通用英语[1] ","《前进,我的母亲埃塞俄比亚》",9月11日[1] ,亚的斯亚贝巴,,,,,,,,,,,,,,,,,,,
布鲁塞尔中心广场,布鲁塞尔大广场,,Grand-Place Brussels,,,,,,,,,欧洲,,,,,,,,,,,,,,,,,,,,,,,,,,,,
蒙克洛亚宫,蒙克洛亚宫,,Moncloa Palace,,,,,,,,,,,,,,,,,,,,,,,,,,,,,,,,,,,,,
萨里郡,萨里郡,,,,,,,,,,,,,,,,,,,,,,,,,,,,,,,,,,,,,,,
西北,西北地区[2] ,,the Northwestern District,,,西北、中国西北,,,,,,,,,汉族、回族、维吾尔族等,,,,,,,,,,,中华人民共和国,,,,麦积山、莫高窟、西夏陵、大雁塔、天山等,,,,,,,,,,
吴中,吴中区,,Wuzhong District,,,,,,,,,,,,,,,,,,,,,320506,市辖区,中国江苏省苏州市,"江苏省苏州市东南部,太湖东岸","7个街道、7个镇,另辖6个乡级单位",苏州市太湖东路288号,"木渎古镇,甪直、太湖景区、天平山、旺山风景区、宝带桥等",,,,,,,,,,
石家庄,石家庄,,Shijiazhuang,,,石门,,,,,,,,,,,,,,,,,,130100,地级市,中国华北地区,"华北平原腹地,太行山东麓,滹沱河上游","8个区、11个县,代管3个县级市",长安区中山东路216号,西柏坡、正定古城、隆兴寺、赵州桥、沕沕水、苍岩山、荣国府,,,,,,邓沛然[17] ,邢国辉,,,
威尼托大区,,威内托大区,,,,,,,,,,,,,,,,,,,,,,,大区,意大利北部,意大利东北部,维罗纳、维琴察、特雷维索等,威尼斯,圣马可教堂、叹息桥、朱丽叶故居等,,,,,,,,,,
约旦,约旦哈希姆王国[1] ,,The Hashemite Kingdom of Jordan;Jordan[1] ,,约旦,,JOR,二元制君主立宪制,国王:阿卜杜拉二世、首相:阿卜杜拉·恩苏尔[1] ,安曼[1] ,89000 km2,亚洲,UTC+2,约旦第纳尔[1] ,阿拉伯人[1] ,伊斯兰教-逊尼派、东正教[1] ,"伊尔比德,亚喀巴等[1] ",阿拉伯语[1] ,《国王万岁》,1946年5月25日[1] ,安曼,,,,,,,,,,,,,,,,,,,
拉脱维亚,,拉脱维亚共和国[2] ,,The Republic of Latvia[2] ,拉脱维亚,,LVA,议会制共和制,总统:埃吉尔斯·列维特斯;总理:马里斯·库钦斯基斯,里加[2] ,64589平方公里[2] ,欧洲,UTC+2(夏时制:UTC+3),欧元[2] ,拉脱维亚人[2] ,基督教路德宗、天主教[2] ,"道加瓦皮尔斯,利耶帕亚,文茨皮尔斯,尤尔马拉等[2] ",拉脱维亚语[2] ,《上帝保佑拉脱维亚》,11月18日[2] ,里加,,,,,,,,,,,,,,,,,,,
安道尔,安道尔公国[1] ,,The Principality of Andorra[1] ,,安道尔,,AND,议会制君主立宪制,大公:埃马纽埃尔·马克龙和霍安·恩里克·比韦斯·西西利亚,安道尔城[1] ,468 km2[1] ,欧洲,UTC+1,欧元[1] ,安道尔人[1] ,天主教[1] ,"卡尼略,恩坎普,马萨纳,奥尔迪诺等[1] ",加泰罗尼亚语[1] ,"《伟大的查理曼,我的父亲》",819年9月8日[1] ,安道尔城,,,,,,,,,,,,,,,,,,,
仙桃市,仙桃市,,Xiantao,,,沔阳、复州、沔州,,,,,,,,,,,,,,,,,,429004,省直辖县级行政单位,湖北省,"湖北省中南部,江汉平原腹地",3街道、15镇、7乡级单位,仙桃市沔州大道特1号,仙桃梦里水乡、沔阳小镇、陈友谅纪念馆、沙湖国家湿地公园、沔街、沔城,,,,,,,,,,
大邱市,大邱,,대구 Daegu[2] ,,,大邱,,,,,,,,,,,,,,,,,,,广域市,韩国岭南地区,朝鲜半岛东南端,"7区,1郡,6邑,3面,130个行政洞,195个法定洞",大邱广域市中区公平路88号,八公山、新川、寿城池、东城路 等,,,,,,权泳臻,,,,
庆尚北道,庆尚北道,,韩文:경상북도;罗马字:Gyeongsangbuk-Do[3] ,,,庆北,,,,,,,,,,,,,,,,,,,道,大韩民国,韩国东南部,"10市13郡,浦项市、安东市等",安东市(庆尚北道道厅新城),,,,,,,,,,,
广域市,,广域市,,,,,,,,,,,,,,,,,,,,,,,中央直辖市,韩国,,,,,,,,,,,,,,
青瓦台,青瓦台,,Cheongwadae/Blue House,,,,,,,,,,,,,,,,,,,,,,,,,,,,,,,,,,,,,
基里巴斯,基里巴斯共和国,,The Republic of Kiribati,,基里巴斯,,KIR,总统制共和制,总统:塔内希·马茂,塔拉瓦(Tarawa),811 km2,大洋洲,UTC+12至UTC+14,通用澳元、美元,密克罗尼西亚人、波利尼西亚人,天主教、基督新教,塔拉瓦(Tarawa),英语,"《站起来,基里巴斯!》",1979年7月12日,塔拉瓦,,,,,,,,,,,,,,,,,,,
延边朝鲜族自治州,延边朝鲜族自治州,,Yanbian Korean Autonomous Prefecture(英语)/연변조선족자치주(朝鲜语),,,延边州、延边自治州,,,,,,,,,,,,,,,,,,222400,自治州、地级行政区[1] ,中国·吉林省,东北亚、中国吉林省东部,6市2县,延吉市公园路2799号,长白山风景区、仙景台自然风景区、安图县明月湖等,,,,,,,,,,
青岛市,青岛,,Qingdao、Tsingtao,,,岛城、琴岛、胶澳,,,,,,,,,,,,,,,,,,370200[20] ,地级市,中国华东地区,"山东半岛东南部沿海,黄海北部",7个区、代管3个县级市,市南区香港中路11号,崂山、五四广场、八大关、栈桥、青岛奥帆中心、金沙滩、大珠山等,,,,,,,,,,
美国领事馆,美国领事馆,,,,,,,,,,,,,,,,,,,,,,,,,,,,,,,,,,,,,,,
威尔特郡,,威尔特郡,,,,,,,,,,,,,,,,,,,,,,,"名誉郡,单一管理区",,英格兰西南区域,,,,,,,,,,,,,
美国疾病控制中心,美国疾病控制与预防中心,,Centers for Disease Control and Prevention,,CDC,,,,,,,,,,,,,,,,,,,,,,,,,,,,,,,,,,,
哈密尔顿,汉密尔顿或哈密尔顿,,Hamilton,,,咸美顿,,,,,,,,,,,,,,,,,,,市,加拿大安大略省,加拿大安大略省东南部,,汉密尔顿,皇家植物花园,,,,,,,,,,
图们江,,图们江,,,,,,,,,,,,,,,,,,,,,,,,,中国吉林省东南部朝鲜东北部,,,,,,,,,,,,,
南韩,大韩民国[3] ,,"韩语:대한민국;英语:Republic of Korea,South Korea[4] ",,韩国,,KOR,总统制共和制,总统:文在寅(Moon Jae-in),首尔[5] ,约 100000 km2,亚洲,UTC+9,"韩元(KRW,₩)[4] ",韩民族[4] ,基督新教、佛教、天主教[6] ,"釜山,仁川,蔚山,大邱,大田,光州,水原,济州市等[4] ",韩语[4] ,《爱国歌》[3] ,1948年8月15日[4] ,,,大陆法系和英美法系,,,,,,,南山塔、乐天世界、雪岳山、济州岛,,,,,,,,,,
鸭绿江,,鸭绿江,,[词典]the Yalu River,,,,,,,,,,,,,,,,,,,,,,,,,,,,,,,,,,,,
大都,,元大都,,,,大都,,,,,,,,,,,,,,,,,,,元朝首都,大都路,北京,,,,,,,,,,,,,
开城工业园,开城工业园区,,"개성공업지구 Kaesong Industrial Region,",,,,,,,,,,,,,,,,,,,,,,,,"平壤南170公里,在开城以南8公里",,,,,,,,,,,,,
文在寅,文在寅,,문재인、Moon Jae-in,,,,,,,,,,,,,,,,,,,,,,,,,,,,,,,,,,,,,
开城,开城特级市,,개성특급시(谚文),,,松都、松岳、开京、松京,,,,,,,,,,,,,,,,,,,特级市,朝鲜民主主义人民共和国,朝鲜西南部,,,开城古迹,,,,,,,,,,
